{"allowed_namespaces":["reference"],"canonical_encoding":"grounding-cjson-v0.1","format_version":"0.1","limits":{"answer_calls":1,"candidates_per_invocation":16,"content_bytes":1024,"content_depth":8,"evidence_tokens":null,"frame_bytes":8192,"items_per_target":4,"model_context_bytes":8192,"model_evidence_bytes":4096,"model_items":8,"provider_attempts":1,"providers_per_target":1,"query_bytes":2048,"resource_claims":null,"rewrite_calls":0,"sources_per_binding":1,"target_groups":2,"tokenizer_sha256":null},"merge_policy":{"encoding":"grounding-cjson-v0.1","path":"merge.json","sha256":"6d0e3c4d94a64ad665a5feb0c6a873fd0cd719eae256b5bf142ed409c689e3ff"},"privacy":{"audit_rule":"no raw user queries or evidence persisted by default; explicit synthetic fixtures only","authorized_providers":["local-exact-lexical"],"cache_rule":"disabled; no cross-query or cross-scope reuse","data_classes":["synthetic-public"],"network":"denied","scope_rule":"exact reference-public scope required before source access"},"profile_id":"reference-exact-lexical-v0.1","projection":{"id":"grounding-data-v1","policy":{"encoding":"raw","path":"projection-policy.txt","sha256":"c72ac70f98657240e7758ba19aa62a5d7d68ed50a96661eb0a0887a4b1fc31e1"},"renderer":{"encoding":"raw","path":"projection-renderer.py","sha256":"f2ffb055a7aeb351c5588d0286f6fd296eb9266dc16b6d7fa030a62c9a40ae96"},"template":{"encoding":"raw","path":"projection-template.txt","sha256":"4391c3191c1381c651f8e3127ed8a7085ce8f76d0bac667db831d6ed052bf420"}},"providers":[{"identity":{"encoding":"grounding-cjson-v0.1","path":"provider.json","sha256":"e583305b9ca239bf424b290664e8176e333686e2775ed7ab5fc5bf222a94d9bd"},"provider_id":"local-exact-lexical"}],"rewrite":{"enabled":false},"router":{"encoding":"grounding-cjson-v0.1","path":"router.json","sha256":"45a62c58dc9cc13d6198d56206da2e3bb33ee43b5aa637543267d4e4c8f526c7"},"source_snapshots":[{"encoding":"grounding-cjson-v0.1","path":"directory-snapshot.json","sha256":"6d573a83e92c46861db4c974db5292a5ef4b8d2e02c83bdcfebfc2b18132d780"},{"encoding":"grounding-cjson-v0.1","path":"notes-snapshot.json","sha256":"1d4edf2a0ac6e245f01c25d917b71ab08b6b39b3c0c483d1ccf8e0d0dc080750"}],"targets":[{"authority":"authoritative","bindings":[{"provider_id":"local-exact-lexical","required":true,"source_ids":["directory"]}],"namespace":"reference","sufficiency_rule_id":"all-required-v1","target_key":"reference:desk","target_label":"Help desk location"},{"authority":"supplemental","bindings":[{"provider_id":"local-exact-lexical","required":true,"source_ids":["notes"]}],"namespace":"reference","sufficiency_rule_id":"all-required-v1","target_key":"reference:desk-tip","target_label":"Help desk visitor tip"}],"timeouts":{"backoff_ms":0,"cancellation_rule":"cancel all pending on host cancellation or retrieval deadline; record timeout","late_result_rule":"ignore results at or after deadline; never update emitted frame","maximum_attempts":1,"measurement_domain":"host-monotonic-milliseconds","partial_result_rule":"discard partial candidates; incomplete required coverage is unavailable","provider_ms":50,"retrieval_ms":100,"retryable_statuses":[],"start_point":"immediately-before-dispatch"},"v":1}